{
  "contractName": "IERC721Receiver",
  "sourceName": "@openzeppelin/contracts/token/ERC721/IERC721Receiver.sol",
  "abi": [
    {
      "inputs": [
        {
          "internalType": "address",
          "name": "operator",
          "type": "address"
        },
        {
          "internalType": "address",
          "name": "from",
          "type": "address"
        },
        {
          "internalType": "uint256",
          "name": "tokenId",
          "type": "uint256"
        },
        {
          "internalType": "bytes",
          "name": "data",
          "type": "bytes"
        }
      ],
      "name": "onERC721Received",
      "outputs": [
        {
          "internalType": "bytes4",
          "name": "",
          "type": "bytes4"
        }
      ],
      "stateMutability": "nonpayable",
      "type": "function"
    }
  ],
  "bytecode": "0x",
  "deployedBytecode": "0x",
  "linkReferences": {},
  "deployedLinkReferences": {},
  "devdoc": {
    "details": "Interface for any contract that wants to support safeTransfers from ERC721 asset contracts.",
    "kind": "dev",
    "methods": {
      "onERC721Received(address,address,uint256,bytes)": {
        "details": "Whenever an {IERC721} `tokenId` token is transferred to this contract via {IERC721-safeTransferFrom} by `operator` from `from`, this function is called. It must return its Solidity selector to confirm the token transfer. If any other value is returned or the interface is not implemented by the recipient, the transfer will be reverted. The selector can be obtained in Solidity with `IERC721.onERC721Received.selector`."
      }
    },
    "title": "ERC721 token receiver interface",
    "version": 1
  },
  "evm": {
    "bytecode": {
      "generatedSources": [],
      "linkReferences": {},
      "object": "",
      "opcodes": "",
      "sourceMap": ""
    },
    "deployedBytecode": {
      "generatedSources": [],
      "immutableReferences": {},
      "linkReferences": {},
      "object": "",
      "opcodes": "",
      "sourceMap": ""
    },
    "gasEstimates": null,
    "methodIdentifiers": {
      "onERC721Received(address,address,uint256,bytes)": "150b7a02"
    }
  },
  "metadata": "{\"compiler\":{\"version\":\"0.8.3+commit.8d00100c\"},\"language\":\"Solidity\",\"output\":{\"abi\":[{\"inputs\":[{\"internalType\":\"address\",\"name\":\"operator\",\"type\":\"address\"},{\"internalType\":\"address\",\"name\":\"from\",\"type\":\"address\"},{\"internalType\":\"uint256\",\"name\":\"tokenId\",\"type\":\"uint256\"},{\"internalType\":\"bytes\",\"name\":\"data\",\"type\":\"bytes\"}],\"name\":\"onERC721Received\",\"outputs\":[{\"internalType\":\"bytes4\",\"name\":\"\",\"type\":\"bytes4\"}],\"stateMutability\":\"nonpayable\",\"type\":\"function\"}],\"devdoc\":{\"details\":\"Interface for any contract that wants to support safeTransfers from ERC721 asset contracts.\",\"kind\":\"dev\",\"methods\":{\"onERC721Received(address,address,uint256,bytes)\":{\"details\":\"Whenever an {IERC721} `tokenId` token is transferred to this contract via {IERC721-safeTransferFrom} by `operator` from `from`, this function is called. It must return its Solidity selector to confirm the token transfer. If any other value is returned or the interface is not implemented by the recipient, the transfer will be reverted. The selector can be obtained in Solidity with `IERC721.onERC721Received.selector`.\"}},\"title\":\"ERC721 token receiver interface\",\"version\":1},\"userdoc\":{\"kind\":\"user\",\"methods\":{},\"version\":1}},\"settings\":{\"compilationTarget\":{\"@openzeppelin/contracts/token/ERC721/IERC721Receiver.sol\":\"IERC721Receiver\"},\"evmVersion\":\"istanbul\",\"libraries\":{},\"metadata\":{\"bytecodeHash\":\"ipfs\",\"useLiteralContent\":true},\"optimizer\":{\"enabled\":true,\"runs\":200},\"remappings\":[]},\"sources\":{\"@openzeppelin/contracts/token/ERC721/IERC721Receiver.sol\":{\"content\":\"// SPDX-License-Identifier: MIT\\n\\npragma solidity ^0.8.0;\\n\\n/**\\n * @title ERC721 token receiver interface\\n * @dev Interface for any contract that wants to support safeTransfers\\n * from ERC721 asset contracts.\\n */\\ninterface IERC721Receiver {\\n    /**\\n     * @dev Whenever an {IERC721} `tokenId` token is transferred to this contract via {IERC721-safeTransferFrom}\\n     * by `operator` from `from`, this function is called.\\n     *\\n     * It must return its Solidity selector to confirm the token transfer.\\n     * If any other value is returned or the interface is not implemented by the recipient, the transfer will be reverted.\\n     *\\n     * The selector can be obtained in Solidity with `IERC721.onERC721Received.selector`.\\n     */\\n    function onERC721Received(\\n        address operator,\\n        address from,\\n        uint256 tokenId,\\n        bytes calldata data\\n    ) external returns (bytes4);\\n}\\n\",\"keccak256\":\"0xd9517254724276e2e8de3769183c1f738f445f0095c26fd9b86d3c6687e887b9\",\"license\":\"MIT\"}},\"version\":1}",
  "storageLayout": {
    "storage": [],
    "types": null
  },
  "userdoc": {
    "kind": "user",
    "methods": {},
    "version": 1
  }
}